[
  {
    "acquisition_method": "HTTP_CAPTURE",
    "adapter_status": "FIXTURE_ONLY",
    "allowed_natures": [
      "DIRECT_OBSERVATION",
      "FIRST_PARTY_STATEMENT"
    ],
    "authority": "ACTIVE",
    "emits": [
      "vendor.present",
      "vendor.mentioned",
      "booking.present",
      "crm.present",
      "esp.present",
      "chat.widget.present",
      "payment.processor.present",
      "automation.platform.present",
      "integration.present",
      "website.platform",
      "vendor.certification_badge",
      "dns.mx.provider",
      "dns.dmarc.policy",
      "dns.spf.includes",
      "dns.txt.verification",
      "dns.cname.service",
      "cert.new_subdomain",
      "api.public.present",
      "app.mobile.present",
      "status.page.present",
      "schema.jsonld.present",
      "schema.jsonld.types",
      "schema.subject_binding",
      "content.page_inventory",
      "content.type.present",
      "seo.cwv.field",
      "seo.indexation",
      "seo.keyword.footprint",
      "seo.authority",
      "seo.local.presence",
      "seo.ai_visibility.cited_in",
      "industry.vertical",
      "industry.subvertical",
      "company.self_claim",
      "company.locations",
      "company.geo",
      "company.age_band",
      "identity.binding_evidence",
      "firmo.employee_band",
      "firmo.revenue_band",
      "firmo.ownership",
      "firmo.funding",
      "person.contact",
      "competitor.presence",
      "hiring.role",
      "ads.activity",
      "news.events",
      "headcount.history",
      "change.page.delta",
      "outreach.outcome",
      "crm.note",
      "account.stage",
      "suppression.dnc",
      "integration.connection.verified",
      "ops.automation.verified",
      "ops.sales.verified",
      "company.business_model",
      "acquisition.coverage",
      "change.template.stable",
      "location.data.consistency",
      "outreach.exposure",
      "careers.page",
      "careers.ats",
      "job.posting",
      "job.status",
      "job.salary",
      "job.work_arrangement",
      "job.location",
      "job.skill_requirement",
      "job.department",
      "job.workflow_statement",
      "job.document_statement",
      "job.tool_statement",
      "job.handoff_statement",
      "job.manual_process_statement",
      "job.spreadsheet_statement",
      "job.crm_statement",
      "job.follow_up_statement",
      "technology.footprint",
      "technology.script",
      "technology.form_action",
      "technology.cookie",
      "technology.header",
      "technology.csp",
      "technology.subdomain",
      "technology.network_request",
      "technology.static_global",
      "technology.account_identifier",
      "product.capability",
      "product.vertical",
      "product.category",
      "product.integration_support",
      "portal.observed",
      "integration.public_marker",
      "review.owner_response",
      "account.industry_membership",
      "phone.cta",
      "phone.routing_observed",
      "phone.routing_verified",
      "phone.recording_verified",
      "phone.call_event",
      "website.business_model_statement",
      "website.customer_type_statement",
      "website.lead_channel_statement",
      "website.sales_motion_statement",
      "website.document_type_statement",
      "website.handoff_statement",
      "website.intent_statement",
      "website.service_offering_statement",
      "website.geographic_market_statement",
      "website.workflow_step_statement",
      "website.role_responsibility_statement",
      "website.knowledge_source_statement",
      "website.intake_method_statement",
      "website.manual_process_statement",
      "website.approval_process_statement",
      "website.data_reentry_statement",
      "website.reporting_process_statement",
      "website.follow_up_statement",
      "website.billing_process_statement",
      "website.scheduling_process_statement",
      "website.compliance_process_statement",
      "document.surface",
      "form.surface",
      "ads.measurement",
      "app.measurement",
      "phone.measurement",
      "seo.measurement",
      "shopping.measurement",
      "technology.measurement",
      "publication.record",
      "publication.statement",
      "organization.event_report",
      "repository.activity_observed",
      "event.authorized_attendance",
      "franchise.disclosure_record"
    ],
    "fixture_only": true,
    "freshness_seconds": 1209600,
    "policy_id": "policy.fixture",
    "provider": "Synthetic website",
    "source_id": "source.web",
    "upstream_namespace": "fixture.web",
    "version": "1.0.0"
  },
  {
    "acquisition_method": "API",
    "adapter_status": "FIXTURE_ONLY",
    "allowed_natures": [
      "THIRD_PARTY_REPORT",
      "FIRST_PARTY_STATEMENT"
    ],
    "authority": "ACTIVE",
    "emits": [
      "seo.keyword.footprint",
      "seo.authority",
      "company.self_claim",
      "firmo.revenue_band",
      "review.metrics",
      "review.response_ratio",
      "hiring.role",
      "crm.note",
      "company.business_model",
      "job.posting",
      "job.status",
      "job.salary",
      "job.work_arrangement",
      "job.location",
      "job.skill_requirement",
      "job.department",
      "job.workflow_statement",
      "job.document_statement",
      "job.tool_statement",
      "job.handoff_statement",
      "job.manual_process_statement",
      "job.spreadsheet_statement",
      "job.crm_statement",
      "job.follow_up_statement",
      "technology.provider_report",
      "product.capability",
      "product.vertical",
      "product.category",
      "product.integration_support",
      "review.record",
      "review.statement",
      "review.owner_response",
      "discussion.record",
      "discussion.statement",
      "account.industry_membership",
      "search.result",
      "business.profile_attribute",
      "backlink.record",
      "web.mention",
      "app.listing",
      "shopping.listing",
      "advertisement.record",
      "phone.routing_verified",
      "phone.recording_verified",
      "website.business_model_statement",
      "website.customer_type_statement",
      "website.lead_channel_statement",
      "website.sales_motion_statement",
      "website.document_type_statement",
      "website.handoff_statement",
      "website.intent_statement",
      "website.service_offering_statement",
      "website.geographic_market_statement",
      "website.workflow_step_statement",
      "website.role_responsibility_statement",
      "website.knowledge_source_statement",
      "website.intake_method_statement",
      "website.manual_process_statement",
      "website.approval_process_statement",
      "website.data_reentry_statement",
      "website.reporting_process_statement",
      "website.follow_up_statement",
      "website.billing_process_statement",
      "website.scheduling_process_statement",
      "website.compliance_process_statement",
      "ads.measurement",
      "app.measurement",
      "phone.measurement",
      "review.measurement",
      "seo.measurement",
      "shopping.measurement",
      "technology.measurement",
      "publication.record",
      "publication.statement",
      "organization.event_report",
      "event.public_participation",
      "event.authorized_attendance",
      "trade.shipment_record",
      "procurement.record",
      "award.listing",
      "franchise.disclosure_record",
      "case_study.report",
      "case_study.outcome_report"
    ],
    "fixture_only": true,
    "freshness_seconds": 1209600,
    "policy_id": "policy.fixture",
    "provider": "Synthetic reviews",
    "source_id": "source.review",
    "upstream_namespace": "fixture.review",
    "version": "1.0.0"
  },
  {
    "acquisition_method": "API",
    "adapter_status": "FIXTURE_ONLY",
    "allowed_natures": [
      "THIRD_PARTY_REPORT"
    ],
    "authority": "ACTIVE",
    "emits": [
      "review.metrics",
      "review.response_ratio",
      "technology.provider_report",
      "product.capability",
      "product.vertical",
      "product.category",
      "product.integration_support",
      "review.record",
      "review.statement",
      "discussion.record",
      "discussion.statement",
      "search.result",
      "business.profile_attribute",
      "backlink.record",
      "web.mention",
      "app.listing",
      "shopping.listing",
      "advertisement.record",
      "ads.measurement",
      "app.measurement",
      "phone.measurement",
      "review.measurement",
      "seo.measurement",
      "shopping.measurement",
      "technology.measurement",
      "publication.record",
      "publication.statement",
      "organization.event_report",
      "event.public_participation",
      "event.authorized_attendance",
      "trade.shipment_record",
      "procurement.record",
      "award.listing",
      "franchise.disclosure_record",
      "case_study.report",
      "case_study.outcome_report"
    ],
    "fixture_only": true,
    "freshness_seconds": 1209600,
    "policy_id": "policy.fixture",
    "provider": "Synthetic community",
    "source_id": "source.forum",
    "upstream_namespace": "fixture.forum",
    "version": "1.0.0"
  },
  {
    "acquisition_method": "API",
    "adapter_status": "FIXTURE_ONLY",
    "allowed_natures": [
      "PROVIDER_ESTIMATE"
    ],
    "authority": "ACTIVE",
    "emits": [
      "seo.keyword.footprint",
      "seo.authority",
      "firmo.revenue_band",
      "seo.measurement",
      "traffic.measurement"
    ],
    "fixture_only": true,
    "freshness_seconds": 1209600,
    "policy_id": "policy.fixture",
    "provider": "Synthetic estimates",
    "source_id": "source.estimate",
    "upstream_namespace": "fixture.estimate",
    "version": "1.0.0"
  },
  {
    "acquisition_method": "API",
    "adapter_status": "FIXTURE_ONLY",
    "allowed_natures": [
      "THIRD_PARTY_REPORT",
      "DIRECT_OBSERVATION"
    ],
    "authority": "ACTIVE",
    "emits": [
      "vendor.present",
      "vendor.mentioned",